,synopsis,demography,type,name,genre,score,book_status,book_cover,read,pending,following,favorite,have,abandoned,uuid
387,"Atractivo, rico, y arrogante Young Joon es el vicepresidente de una corporación importante, Miso ha sido su secretaria perfecta, prácticamente una leyenda por sobrevivir a su jefe narcisista durante 9 largos años, sin embargo ahora que ella está renunciando, ¿Realmente no hay nada o nadie, que pueda evitar que se vaya? Basado en las novelas exitosas originales y ahora adaptado a un dorama -> pueden buscar el dorama con el mismo nombre, ya esta finalizado<-",Josei,MANHWA,¿Qué está mal con la secretaría Kim? ( 1998 ),"Drama, Romance, Comedia",9.64,FINALIZADO,https://otakuteca.com/images/books/cover/5b80f722e45b5.jpg,7.7K,4.5K,7.9K,3.9K,1.2K,507,9fa273f3-34ac-4362-bd39-ec214e3d618b
388,"En lugar de tirar de los hilos rojos del destino entre los humanos, el dios del matrimonio descendió a la tierra para evitar que alguien tuviera una cita. El matrimonio del protagonista es la clave para el fin del mundo. Esta es una historia de comedia romántica de cohabitación entre un obsesivo dios del matrimonio y una profesora con un alto temperamento.",Josei,MANHWA,El casamentero me prohíbe tener citas ( 2019 ),"Comedia, Fantasia, Romance",9.00,PUBLICÁNDOSE,https://otakuteca.com/images/books/cover/5c58d3ac1eb57.jpg,322,2.7K,3.7K,878,482,360,dc3d7971-c585-4e97-ac37-c693bdd8bb19
389,"Jang Seungmin, un autoproclamado actor, filma un drama con el actor coreano Ha Hyunjae. Seungmin sospecha que este hombre ha tomado la iniciativa, siendo un hombre no sólo de buena apariencia y habilidades de actuación, sino también en su historia.",Josei,MANHWA,One Take ( 2020 ),"Boys Love, Drama, Psicológico",10.00,FINALIZADO,https://otakuteca.com/images/books/cover/5f0914b904c86.jpg,3K,5.1K,4.6K,2.4K,1.3K,391,4a4d9a17-f94c-482b-a08e-58ac90d5b96c
390,"Eugene, que imprimió a Minwoo empezó a soñar sólo con vivir con él. Eugene, que está confundido, se enfrenta a un reto en su vida. Minwoo de repente empieza a rechazar a Eugene. Mientras tanto, un nuevo espíritu de un nuevo romance apareció frente a Minwoo...",Josei,MANHWA,Deep ( 2020 - 2021 ),"Boys Love, Fantasia",8.14,FINALIZADO,https://otakuteca.com/images/books/cover/5f6d1cce678d9.jpg,11.3K,14.4K,16.6K,9.9K,3.8K,1.3K,5251ef94-643f-4a95-af14-4f0989a25516
391,"Yo, Han Ji-An, estoy luchando como una actriz sin nombre. Para empeorar las cosas, terminé cayendo por las escaleras y muriéndome por culpa del club de fans de la superestrella Ji So-Won. Sin embargo, en realidad, ¡Ji So-Won es una parca que intenta llevarme a la otra vida! ¡¿Eso no puede ser verdad ?! No estoy lista para dejar esta vida. No. ¡No debería ser yo!",Josei,MANHWA,PARCA ENCANTADORA,"Romance, Sobrenatural",0.00,PUBLICÁNDOSE,https://otakuteca.com/images/books/cover/5cda59d568857.jpg,302,1.5K,2.8K,607,278,258,ed8d3009-60e0-4918-b23a-e67bfa1df0c6
392,"""Hildegar"", una bruja que recibe la bendición de Kariya, el dios del sol. ""Erkin"", un hombre del norte que perdió su ciudad natal, se dirige tras la bruja a un castillo sin nombre.",Josei,MANHWA,Cegado por el sol poniente ( 2020 ),"Drama, Historia, Fantasia, Magia, Romance",10.00,PUBLICÁNDOSE,https://otakuteca.com/images/books/cover/5ee3eee78e714.jpg,1.8K,10.7K,16.3K,5.4K,2.7K,1.4K,e3fab665-0a83-4d9a-a6c7-eea0abad9eaf
393,"""Mientras te guste"" es un manhwa creado por Quan Zhen'e (Coco Comic). El cómic dice que Diane es la criada de la residencia del marqués Rowe. Para ayudar a la dama de la mansión a escapar del matrimonio, envió a la dama fuera del país, y vestida como ella, fue al castillo del norte. La familia Effenhard ha estado vigilando la frontera norte por generaciones y nunca ha salido del territorio. El mundo exterior está lleno de curiosidad acerca de esta familia. ¿Descubrirán la identidad de Diane? ¿Qué historia romántica sucederá durante el tiempo que convian en el castillo?",Josei,MANHWA,MIENTRAS TE GUSTE,"Fantasia, Romance",9.00,PUBLICÁNDOSE,https://otakuteca.com/images/books/cover/61aed8df8a728.jpg,1.9K,9.4K,17.3K,5.5K,2.2K,2K,fb89accc-83f3-4cc7-a55c-c84afb35ab94
394,"Eun-Oh siempre está solo debido a su peculiar capacidad de ver hadas. Pero un día, Jae-Hwi, un estudiante transferido, se acerca a Eun-Oh sin dudarlo. ""Cuando estoy contigo, me siento bien"", dijo, sacudiendo el corazón de Eun-Oh.",Josei,MANHWA,Do You Know a Fairy? ( 2018 - 2018 ),"Boys Love, Sobrenatural",9.00,FINALIZADO,https://otakuteca.com/images/books/cover/60d0e7c07f3b1.jpg,5K,3.1K,3.1K,2.4K,893,271,388a8b3b-c5bf-424f-8f0b-250b0b7215ce
395,"Sin un trabajo estable ni un hogar, Joo May vive de manera imprudente, pasando de la casa de un amante a la otra. Un día, May se desmaya, casi golpeado hasta la muerte por un ex novio con el que se encontró. Cuando se despierta, se encuentra encadenado en la casa de Shin Jooin, el hombre limpio que aparentemente lo rescató. Pero hay algo raro en Jooin, que trata a May casi como una mascota ¿Quién es realmente Jooin, y qué está escondiendo?",Josei,MANHWA,May Belongs to Me ( 2018 - 2019 ),"Boys Love, Drama, Romance",8.50,FINALIZADO,https://otakuteca.com/images/books/cover/5cedb3764c609.jpg,11.5K,7K,7.2K,3.9K,1.8K,666,5e747783-4724-40c4-b404-37eefae0d781
396,"El emperador Lukadis, quien es llamado sucesor del dragón y guardián del imperio, visita de repente a Dyke, un caballero retirado que vive en paz con su hija en un pueblo rural después de la guerra. Un mago joven y encantador, el emperador Lucasdis y Dyke, un caballero un poco aterrador pero recto. La relación entre los dos es profunda, ¡¿pero parece que sucedió algo inusual ?! Mientras tanto, la rueda del destino comienza a fluir en una nueva dirección. ¡Una dulce y amarga historia de amor!",Josei,MANHWA,A Broken Heart Flows ( 2019 - 2021 ),"Comedia, Acción, Aventura, Fantasia, Historia, Romance, Boys Love",9.00,FINALIZADO,https://otakuteca.com/images/books/cover/5fe51358d1086.jpg,2K,7.9K,10.1K,3.9K,2.3K,1K,20cd1dde-5585-4f71-8877-ad7a79a78037
397,"¿Qué harías si pudieras hablar con tu personaje de ficción favorito todos los días? ¿Y qué si te hicieran sentir como la persona más especial en el mundo? “Buenos días”, “Estaba pensando en ti”, “Dulces sueños”, “Te veo mañana” … Algunos fans de sumergen en sus obsesiones de TV/Películas/Libros en las redes sociales interactuando con cuentas que asumen el rol de la persona de sus personajes favoritos. Pero, ¿Qué pasaría si la persona tras la cuenta ficticia es en realidad … la estrella que hizo el rol?",Josei,MANHWA,Star x Fanboy ( 2017 - 2020 ),"Boys Love, Romance, Comedia",9.67,FINALIZADO,https://otakuteca.com/images/books/cover/5c97fdac69f2e.jpg,4.1K,5.7K,6K,3.7K,1.1K,421,fd3f5b0a-7192-4e4d-9ef6-253269c603a0
398,"Era un verano en el que incluso respirar era difícil debido al calor. El aire acondicionado en la habitación de An Kyungsoo estaba dañado durante mucho tiempo. Como reemplazo, su propietario le envió un acondicionador de aire humanoide que está de moda en el extranjero, tomando forma en un guapo modelo masculino. Tan pronto como se enciende, se volvió tan genial que lo abrazó, pero no puede evitar sentirse un poco raro. Mientras acurrucaba este reemplazo temporal de su A C, presionó un botón ubicado en ""algún lugar"" y abrió sus ojos. Resulta que su humanoide no solo tenía una cara bonita, sino que también tenía una personalidad amable y una voz gentil ... Este comportamiento de AC totalmente perfecto incluía gradualmente el skinship, así como el alivio de su deseo sexual que había sido sofocado por el calor..",Josei,MANHWA,Hot and Cold ( 2018 - 2018 ),"Boys Love, Comedia, Ciencia Ficción",8.33,FINALIZADO,https://otakuteca.com/images/books/cover/5c58ff298c39a.jpg,18.1K,4.5K,4.6K,5.3K,1.4K,356,2d4439fd-9052-4201-8cd9-8d11ea483d8d
399,"Un día, el estudiante universitario Wooseung siente un profundo sentimiento hacia el arte hecho por su Seonbae, Sunjin, en primera instancia entiende este sentimiento como 'Amor'. Siguiendo su ""amor"" por su superior, se confiesa a Sunjin, sólo para descubrir que Sunjin también lo ""ama"" ... pero sólo mente de una manera un tanto diferente.",Josei,MANHWA,Todo acerca de la Lujuria ( 2016 - 2017 ),"Boys Love, Comedia, Romance, Drama, Parodia, Recuentos de la vida, Vida Escolar",9.50,FINALIZADO,https://otakuteca.com/images/books/cover/23214_TMOManga589ebe73c6cf0.jpg,5.8K,11.7K,13.2K,4.2K,2.1K,956,ef7e0dc3-893e-4546-8a3e-b917799352f8
400,"Kim Gitae, quien renunció a su trabajo y ha estado holgazaneando por la casa, vio un póster para reclutar trabajadores a tiempo parcial en un gimnasio. Con la fantasía de obtener un buen cuerpo y evitar las molestias de su madre, aplicó para el puesto Ya en el gimnasio, vio el fantástico cuerpo del entrenador, Soohyeon. En ese breve momento que hizo que Kim Gitae escuchara latir su corazón sin saber por que , en el gimnasio casi se lesiona ... pero fue Soohyeon quien resultó herido después de salvarlo. Luego, Soohyeon le pide un favor a Gitae que no pudo rechazar ya que se sentía culpable ...",Josei,MANHWA,Coexistencia ( 2020 ),"Boys Love, Comedia, Romance",8.67,FINALIZADO,https://otakuteca.com/images/books/cover/5e962cc8dad0e.jpg,9K,1.9K,1.9K,1.8K,697,223,9f89ca37-1fd6-4b58-b272-b3e2a65b0d7c
401,"Dos amigos de la infancia, Eunchae y Jiho, deciden golpearse el uno al otro con un rascador de espalda para alejar la mala suerte. ¿Y por qué no hacerlo? No hay nada extraño en dos chicos haciéndose un favor mutuo… ¡tú rascas mi espalda y yo rasco la tuya! Pero a veces a veces es algo difícil hacer entrar en razón a alguien… o detener ciertas sensaciones en su cuerpo. Algunas sensaciones muy buenas. Ya que sus cuerpos repentinamente comienzan a reaccionar a cada golpe en su relación, ¿Podrán sus corazones terminar atándose juntos por siempre? Mucha suerte, en donde sea que eso comience…",Josei,MANHWA,Whatever the Start May Be ( 2020 - 2020 ),"Boys Love, Romance",8.33,FINALIZADO,https://otakuteca.com/images/books/cover/5ebf5c898d1d4.jpg,3.4K,7K,7.7K,2.9K,1.8K,805,7e15e39b-e0f5-4040-89f7-d6404f10bf92
402,"Discípulos y maestros, la distancia entre dos personas que parecen cercanas pero demasiado distantes. Un estudiante de secundaria que está luchando con un amor no correspondido por una larga distancia, un sueño de una vida pasada. Un amor fatídico que no tuvo más remedio que sumergirse, sintiéndose profundamente empapado. Park Hyun, que quiere tener para el solo a Han lee Eum, que pasa con este amor que esconde su pasado.. se enciende a la luz de las velas y cae en un sueño.",Josei,MANHWA,Retrato de ensueño ( 2019 ),"Boys Love, Reencarnación, Romance, Vida Escolar",10.00,FINALIZADO,https://otakuteca.com/images/books/cover/5ed7e7f667cfd.jpg,1.7K,4K,3.1K,1.4K,921,309,808ba4af-93a9-40fd-b9b5-a7e8e00cd3ad
403,"Después de un terrible incendio que casi consume el hogar de Sihoo, su vida finalmente ha vuelto a la normalidad excepto... que no tiene recuerdos. Un amnésico, no puede recordar mucho más allá de su propio nombre y el café en el que trabaja. Entonces, un día, su antiguo compañero de clase Yesung Min entra y ayuda a Sihoo a recordar todo lo que alguna vez importó: estaban enamorados. De las cenizas de su vida, surge una vieja llama.",Josei,MANHWA,A Trace of You ( 2020 ),"Boys Love, Drama, Familia, Misterio, Tragedia",9.50,FINALIZADO,https://otakuteca.com/images/books/cover/5f17aa491f395.jpg,5.6K,6.5K,5.5K,3.2K,1.5K,400,3a8ff2c8-2c36-49d1-affe-1b5e10d69de0
404,"Las encantadoras damas flores de Moonlight Garden (Jardín Luz de Luna) son codiciadas por todos, ya que se sabe que proporcionan placeres sexuales más allá de la imaginación. Pero Dohwa, una joven dama flor que aún no ha ""florecido"", prepara pociones con la esperanza de escapar de su destino en el burdel. Una noche, ella es atrapada robando ingredientes para sus pociones por Lady Hyewon, la nueva dueña del Jardín. Pero resulta que Dohwa no es la única con una agenda. Lady Hyewon alberga algunos terribles secretos propios.",Josei,MANHWA,Moonlight Garden ( 2017 ),"Girls Love, Historia, Romance, Sobrenatural",9.86,FINALIZADO,https://otakuteca.com/images/books/cover/25263_TMOManga59049bce3e89c.jpg,4.4K,6.9K,8.8K,3.7K,1.3K,582,d030cf66-0645-4063-850e-6436325258ee
405,"Una chica rica y hermosa, y la heredera al centro de difusión de GBS. Un apuesto presentador de noticias con ambiciones ilimitadas. Una magnífica productora de backstage con un secreto. Tres personas con diferentes metas y deseos. ¡Un thriller sobre un triángulo amoroso que los mantendrá al borde de sus asientos!",Josei,MANHWA,The Third Party ( 2017 ),"Drama, Girls Love, Romance",9.00,FINALIZADO,https://otakuteca.com/images/books/cover/22448_TMOManga58793f515e18c.jpg,4.1K,4.7K,6.7K,1.6K,676,334,a95a2ac9-ddba-40ec-96b4-17ecda670261
406,"Sobre Cho Ayeon y su camino hacia la redención. Romper los lazos con alguien es fácil, pero olvidar y seguir adelante es totalmente diferente. Ayeon recibe de repente la noticia de que un chico que acaba de conocer le gusta. ¿Será esta una oportunidad para que aprenda a enamorarse de otra persona y aprenda de los errores que cometió en el pasado? Side-story del manhwa ""Never Understand"".",Josei,MANHWA,Incorrigible ( 2019 ),"Boys Love, Drama, Romance",8.50,FINALIZADO,https://otakuteca.com/images/books/cover/5d489d57ae7ff.jpg,26.4K,11.2K,11.1K,16.1K,2.8K,546,0fa0cd53-8bf3-470e-8c5b-90c0001abc29
407,"Amable, carismático y místico Taeo y el solitario y misterioso Ho, los dos están saliendo en secreto. Pero luego Taeo está confundido por el comportamiento desconocido de Ho y lo diferente que es de lo que él conocía. Entre dos personas que están en peligro de romperse. ¿Cómo terminarán estos dos corazones ardiendo peligrosamente?",Josei,MANHWA,Sexto sentido ( 2017 - 2018 ),"Boys Love, Romance, Drama",9.15,FINALIZADO,https://otakuteca.com/images/books/cover/34738_TMOManga5a62b8357315b.jpg,6.3K,6K,6K,2.7K,1.2K,375,1a48806d-3984-4ead-a613-aa34ceff4d0d
408,Información no completada,Josei,MANHWA,Lo Que Tu Deseas ( 2020 ),"Boys Love, Romance",0.00,PUBLICÁNDOSE,https://otakuteca.com/images/books/cover/5e4a5f27a8d11.jpg,374,2.6K,2.4K,844,523,252,5b6aea49-ab72-4cc6-89c5-78c43f6bce61
409,"El joven Cheolwoo de Corea se va de viaje al hermoso lugar vacacional, la Isla del Mañana, solo para perder sus pertenencias importantes poco después de su llegada. Como un omega, Cheolwoo necesita sus inhibidores, así que comienza un trabajo de medio tiempo inmediatamente... Entonces ocurre su fatídico encuentro con Dylan, y él experimenta lo que es estar en medio de un torbellino de feromonas.",Josei,MANHWA,"Calle 69, Isla del Mañana ( 2019 - 2019 )","Boys Love, Romance",0.00,FINALIZADO,https://otakuteca.com/images/books/cover/5ea5489e971a1.jpg,4.5K,2.4K,2.4K,1.3K,661,234,cf685cf2-0138-4ccb-bfdf-c210ea511739
410,"Durante mil años, una línea de reyes ha escondido un terrible secreto debajo de su castillo. Desafiando la ley natural, han sellado al malvado dios serpiente, Nahash, en una cámara subterránea. Cada luna llena, uno de sangre real debe entrar en la cámara para satisfacer el deseo de Nahash por los placeres crueles de la carne. El rey Erus Carus Cordis, el último de su línea, debe mantener a Nahash sellado y evitar el infierno en la tierra. Erus no tiene más remedio que buscar la ayuda de otro. Un caballero que también puede exigirle al rey que lo sirva con las manos y las rodillas.",Josei,MANHWA,El rey del Dragón ( 2019 ),"Boys Love, Fantasia, Sobrenatural",0.00,PUBLICÁNDOSE,https://otakuteca.com/images/books/cover/5ddc6ac6082b6.jpg,527,3.4K,4.1K,1.2K,711,443,460cab03-39f3-4ca9-a461-7641862ea146
411,"Chungho nunca rompe el código de vestimenta y Park Jun siempre lo hace, junto con sus aretes y (naturalmente) cabello rizado. Pero sucede que Chungho es el que siempre se mete en problemas, mientras que Jun es tratado como el hijo perfecto de la secundaria Buk Cheon. No tiene nada en común, pero aun así son mejores amigos. Sin embargo, Chungho tiene un secreto que no puede contarle a nadie, especialmente a Jun... Y ese secreto es... ♥",Josei,MANHWA,Amor entre chicos ( 2020 ),"Boys Love, Comedia, Recuentos de la vida",9.50,PUBLICÁNDOSE,https://otakuteca.com/images/books/cover/5ea5714a742ca.jpg,743,2.6K,2.9K,1.1K,651,245,cda7d096-5b1e-43c9-9a3d-a155e4abb762
412,"¡Hey! ¡Se hará una gran fiesta en el Hotel Ojakgyo! ¡Eso no es una fiesta, es una orgía!. Finalmente se realizará el gran evento para alfas y omegas del Hotel Ojakgyo, donde la relación entre los mejores amigos Kang Dohun y Lim Yejoon, avanza del coqueteo al romance, pero el hermano de Kang Dohun desea al omega dominante Lim Yejoon, por lo que realiza una conspiración en el Hotel Ojakgyo para para poder tenerlo, ¿Qué sucederá? Autor: Achim",Josei,MANHWA,Hotel Ojakgyo ( 2020 ),"Boys Love, Romance",9.20,FINALIZADO,https://otakuteca.com/images/books/cover/5fd63b1be7709.jpg,21.6K,7.3K,7.4K,7.1K,2.4K,570,141a1f49-5a27-4ce8-bd9f-c7dcdc81d8e4
413,"""¿Quieres casarte conmigo?"" ¡Conocí a un extranjero moreno y me casé el primer día! Una estudiante universitaria, Koharu, que administra la pensión de la abuela, recoge a un hermoso extranjero, Abel, por la noche. Koharu decide invitarlo a la casa de huéspedes, sin pasar por alto a Abel, que tenía problemas para hacer los arreglos para el dormitorio de la universidad. Cuando estaba a punto de bañarme esa noche ... ¡Me encontré desnudo con Abel! ""¿No es mejor estar un poco más alerta? O ... ¿estás invitando?"" Abel le susurró dulcemente a Koharu, quien accidentalmente había estado en contacto cercano con el accidente. Además, se le propuso que ""¡Siempre estaba buscando una mujer como Koharu!"" Una vida animada que comienza en una pensión con solo estudiantes internacionales guapos ☆",Josei,MANHWA,Ikoku no Ookami-san to Hitotsu Yane no Shita ( 2019 ),"Ecchi, Extranjero, Romance",0.00,PUBLICÁNDOSE,https://otakuteca.com/images/books/cover/5eb218a860fd2.jpg,716,2.2K,4.1K,1K,788,523,10e61f34-54ef-4072-ba70-91fae8b21227
414,"La vida en la áspera y deteriorada calle Ira no es fácil en el mejor de los casos, pero una reciente serie de asesinatos ha dejado a los residentes traumatizados. Sin embargo, no Shavonne. Está demasiado ocupado tratando de arreglárselas como para preocuparse por algún asesino. Sin embargo, todo eso cambia cuando conoce a su peculiar nuevo vecino. Lewellyn es joven y guapo, pero excéntrico. ¿Por qué pasa todo el día pelando cebollas en las escaleras del apartamento hasta que sus ojos están enrojecidos? ¿Y qué pasa con esas sucias uñas negras? Sin embargo, Shavonne acepta a regañadientes una invitación a cenar en casa de su vecino. Pero después de que hace un descubrimiento espantoso durante la comida a la luz de las velas, de repente los asesinatos se sienten mucho más cercanos a casa...",Josei,MANHWA,Murderer Lewellyn's Enchanting Dinner Invitation ( 2020 - 2022 ),"Boys Love, Crimen, Psicológico, Romance, Historia",9.93,FINALIZADO,https://otakuteca.com/images/books/cover/5fbab50e8463a.jpg,7K,16.3K,19.4K,11.9K,4.1K,1.3K,33a4fa9c-ef2d-4392-abc9-601f68e10c9f
415,"'Kyun-seok', que era un bastardo pero tenía excelentes habilidades, finalmente fue expulsado de la casa y vive en las afueras, pero está satisfecho con su vida. Un día, su hermano mayor, 'Jin-seok', que se había negado hace 10 años, se le acerca y le dice que quiere atrapar a una 'sirena' que está flotando en los rumores. Yeon-seok recuerda a la sirena que lo salvó de ahogarse cuando era niño .. Un erudito que se convirtió en sirena por una maldición y él. Un hermoso drama histórico BL realizado por Yeonseok, quien ha sido ayudado dos veces por",Josei,MANHWA,Arrows Of Swimming ( 2018 ),"Boys Love, Fantasia",0.00,PUBLICÁNDOSE,https://otakuteca.com/images/books/cover/5b822299886b5.jpg,393,2K,2.7K,814,432,305,6fb62d1d-1cd0-4e9b-8335-aae482eabd97
416,"Pasando por una dificultad financiera, Ed decide visitar el estudio pornográfico ""Glen McQueen"" y en secreto empieza a trabajar allí bajo el apodo de ""Tommy"". Pero, por la culpa del cambio de turno horario de su pareja de rodaje, se vio obligado a rodar con el mismo dueño del estudio, Glen.",Josei,MANHWA,Walk on Water ( 2018 - 2020 ),"Boys Love, Drama",9.57,FINALIZADO,https://otakuteca.com/images/books/cover/5bf1b9a88e521.jpg,29K,18.8K,22.2K,17.8K,4.3K,1.3K,18dce9f3-58f0-48d9-a05b-c04130c94ed6
417,"Se Woong, no pudo expresar sus sentimientos de manera adecuada cuando tuvo su primer amor. Ahora que es mayor, en su monótona vida aparece un joven el cual hace su vida más llevadera. Poco después se entera que el joven es hijo de su primer amor de juventud.",Josei,MANHWA,Por ti ( 2016 - 2016 ),"Boys Love, Drama, Romance",8.00,FINALIZADO,https://otakuteca.com/images/books/cover/5cef4ae28d494.jpg,1.5K,2.7K,2.2K,678,539,389,b20949c1-4918-4807-9517-f0522de140b4
418,"Después de la guerra santa, el reino demoníaco cayó en una recesión económica. Para recomenzar su vida, el rey demonio Hel comenzó un trabajo de medio tiempo. Pero, desde machos musculosos a jovencitos bonitos, ¿su lugar de trabajo es un ""club gay solo para caballeros"" abierto las 24 hs?",Josei,MANHWA,La doble vida del Rey Demonio ( 2021 ),"Boys Love, Comedia, Demonios, Fantasia, Romance, Sobrenatural",9.00,PUBLICÁNDOSE,https://otakuteca.com/images/books/cover/5ed8427e1e0af.jpg,4.8K,18.4K,30.5K,13.4K,5.1K,2.5K,4c135802-ad0c-4049-9fb6-d0a53a5162b6
419,"""Me anamoré a primera vista, ¡Pero no puedo hacer eso!"" Woojin, popular con los animales tanto que se puede considerar un gato, no puede acercarse a las personas debido a su aspecto sombrío y su personalidad tímida. Por otro lado Sang-yoon el dueño de la cafetería de perros quien parecía ser el destino en persona ¡Era tan guapo! ¡Demasiado brillante! ¡Demasiado amigable! A diferencia de la primera vista, Woojin no tiene el coraje para decir una palabra sobre querer trabajar en el café todos los días. Quiero seguir cerca del jefe, quiero ser amigable, ¿Pero puedo seguir siendo yo?",Josei,MANHWA,Affectionately ( 2020 ),"Boys Love, Comedia, Ecchi, Romance",9.40,FINALIZADO,https://otakuteca.com/images/books/cover/5f24443d7a91c.jpg,13.1K,10.3K,13.1K,8.3K,3K,863,50f4539b-45f6-4db5-a2bf-192dfbeb71bc
420,"Testigo de un asesinato perpetrado por la mafia, Jack Francisco, cirujano, se convirtió en el hombre a matar. Pero, D, el asesino a cargo de eliminarlo, no puede jalar el gatillo cuando encuentra su rastro y decide protegerlo. De ahora en adelante los dos hombres son el objetivo de una caza despiadada. Forzados a ayudarse para sobrevivir, descubrirán que tienen más para compartir y forjarán un vinculo más fuerte de lo que esperaban…",Josei,MANHWA,Protección cercana ( 2017 ),"Boys Love, Drama, Romance, Acción, Crimen",9.00,FINALIZADO,https://otakuteca.com/images/books/cover/5ddc977878684.jpg,1.5K,3.6K,3.3K,1.5K,898,414,ae2420a9-e852-41fd-bda6-d09fff5299cc
421,"Kyuho Je quiere salir. Ardiente, rico y con un plan, está buscando salir de la mega corporación multinacional de su familia porque, en serio, el negocio es aburrido. Necesitará ayuda para ganar más dinero rápidamente: ¡el inteligente lavador de dinero Kangha Nam (nombre en clave: Pitufo) es perfecto para el trabajo! Pero no es fácil mantener a Kangha cerca de los paparazzi y la familia constantemente vigilantes, y Kyuho necesitará más que secuestro y contratos para mantenerlo en sus manos. ¿Recibirá más (y querrá más) de lo que esperaba?",Josei,MANHWA,Smurf's World ( 2019 ),"Boys Love, Drama, Romance, Comedia",9.67,PUBLICÁNDOSE,https://otakuteca.com/images/books/cover/5e77ad5b94894.jpg,1.8K,7.3K,8.7K,3.4K,1.7K,746,774f3bf8-be31-4aae-ab77-70cd949b4860
422,"A una edad temprana, la pequeña Bella fue abandonada por un niño en el que confiaba para sobrevivir. Ella creció invisible, no escuchada, y una esclava de guerra. Años más tarde, después de perder su capacidad de hablar, se encuentra abrazada por el hombre que una vez la traicionó. Bella se da cuenta de que el hombre, Kiris, se ha olvidado de ella, y su comprensión puede llegar demasiado tarde. En este desgarrador romance de fantasía sobre cómo superar la historia y encontrar el amor nuevamente, ¿podrá Bella perdonar y olvidar? Traductor : Lek Scan editor: The Fallen Angel",Josei,MANHWA,En el regazo de su Majestad ~S2,"Drama, Historia, Romance",0.00,PUBLICÁNDOSE,https://otakuteca.com/images/books/cover/5ed854b231589.jpg,667,3.5K,4.3K,1.6K,772,564,a8c23b9c-50ba-4109-8c52-0a00157fe72f
423,"Después de perder la memoria, Shen Yiqiu, un discípulo de la secta que aprecia la pureza, conoce un hombre muy especial llamado Yan Loufeng, quien es el líder del malvado culto del viento divino",Josei,MANHWA,cisne solitario ( 2019 ),"Acción, Boys Love, Fantasia, Romance",9.00,PUBLICÁNDOSE,https://otakuteca.com/images/books/cover/5e4ae9fac5e5c.jpg,449,3.8K,3.6K,1.3K,729,359,fa43a536-9ac6-46e5-95d6-369823233c03
424,"En su lecho de muerte, una querida abuela deja un último y aterrador deseo: ""Que su nieta se reúna con el horrible y malvado ex-esposo con el que no duró ni un año"". En cambio, Garyung promete vivir sola para siempre, incluso si eso significa renunciar a toda su herencia. Pero... cuando un incendio desastroso amenaza con despojar a Garyung de su imperio de la moda que tanto le costó ganar, se ve obligada a aceptar el dinero y al hombre en juego. Donde hay odio, ¿Hay también ... amor?",Josei,MANHWA,Enemigos Ardientes ( 2019 ),"Comedia, Romance",9.00,PUBLICÁNDOSE,https://otakuteca.com/images/books/cover/5dd73f92357f5.jpg,816,3.6K,6K,1.8K,866,533,4d274c35-17c2-4b6f-b24b-bf0333fc2243
